{
  "schema": 2,
  "release": "v0.7.0",
  "date_release": "2026-10-26",
  "prerelease": false,
  "packages": [
    {
      "zip": "alfatreze.TAU_0.7.0_2026-10-26.zip",
      "zip_sha256": "5850e0b23c35d74aeda624c1acde68d7d660711bf8029cface08e66b95ba6447",
      "core_id": "alfatreze.TAU",
      "bitstream_sha256": "48b59a3bc0ec9faa95b7bc497fe7082a3a94137f5c05758f8630974d5724619a",
      "bitstream_core_version": "4D50331B",
      "bitstream_features": [
        "FONT",
        "HALCYON",
        "LPC",
        "POLY",
        "SDRAM_BUSY"
      ],
      "rom_sha256": "a3fa77ee447d5d8b8dda279ba037324a33e362d0052be945faaff406bc8b97bf",
      "cold_sha256": "8e906eac625c5b08b4bf75e07d6630da14d8e8143d702566ab893d4114367dfc",
      "rom_accepts": [
        "4D50331B"
      ],
      "rom_needs": [
        "FONT"
      ],
      "rom_version": "0.7.0+1f667418",
      "replaces": [
        "alfatreze.TAU_DIAGNOSTIC",
        "alfatreze.TAU Diagnostics",
        "alfatreze.TAU Preview",
        "alfatreze.TAU Preview Diagnostics"
      ],
      "layout": [
        {
          "path": "Assets/tau/alfatreze.TAU/TAU.json",
          "role": "obsolete",
          "slot": null,
          "required": false
        },
        {
          "path": "Assets/tau/alfatreze.TAU/tau-cold.bin",
          "role": "owned",
          "sha256": "8e906eac625c5b08b4bf75e07d6630da14d8e8143d702566ab893d4114367dfc",
          "slot": 6,
          "required": false
        },
        {
          "path": "Assets/tau/alfatreze.TAU/tau-loading.bin",
          "role": "owned",
          "sha256": "85bd29278b0ba0518bb46fecdbdd6786003407c3ee8e8e9abfcccf2d783fb2ec",
          "slot": 4,
          "required": false
        },
        {
          "path": "Assets/tau/alfatreze.TAU/tau-packs.bin",
          "role": "owned",
          "sha256": "f945b9ed079155963df15fb910e4a0f5040235c61c1b3d9db608463ef88de23c",
          "slot": 9,
          "required": false
        },
        {
          "path": "Assets/tau/alfatreze.TAU/tau.rom",
          "role": "owned",
          "sha256": "a3fa77ee447d5d8b8dda279ba037324a33e362d0052be945faaff406bc8b97bf",
          "slot": 1,
          "required": true
        },
        {
          "path": "Assets/tau/common/**/*.{flac,mp3}",
          "pattern": true,
          "role": "user",
          "slot": 2,
          "required": false
        },
        {
          "path": "Assets/tau/common/**/tau-art/cover_128.pal256.timg",
          "pattern": true,
          "role": "generated",
          "slot": 7,
          "required": false,
          "format": {
            "name": "TIM1",
            "version": 1
          }
        },
        {
          "path": "Assets/tau/common/tau-assets.bin",
          "role": "user",
          "slot": 8,
          "required": false,
          "format": {
            "name": "TAUA",
            "version": 1,
            "sections": [
              "METR",
              "PRST",
              "THEM"
            ],
            "max_bytes": 65536,
            "preserve_unknown_sections": true
          }
        },
        {
          "path": "Assets/tau/common/tau-cold.bin",
          "role": "obsolete",
          "slot": null,
          "required": false
        },
        {
          "path": "Assets/tau/common/tau-library.tdb",
          "role": "generated",
          "slot": 5,
          "required": false,
          "format": {
            "name": "tau-library",
            "version": 1,
            "root": "/Assets/tau/common/"
          }
        },
        {
          "path": "Assets/tau/common/tau-loading.bin",
          "role": "obsolete",
          "slot": null,
          "required": false
        },
        {
          "path": "Assets/tau/common/tau.rom",
          "role": "obsolete",
          "slot": null,
          "required": false
        },
        {
          "path": "Cores/alfatreze.TAU/audio.json",
          "role": "owned",
          "sha256": "64993a5e54ccec690f8ef50234a4a2e575f09ea69fd996fbd3852af3776b30da",
          "slot": null,
          "required": false
        },
        {
          "path": "Cores/alfatreze.TAU/bitstream.rbf_r",
          "role": "owned",
          "sha256": "48b59a3bc0ec9faa95b7bc497fe7082a3a94137f5c05758f8630974d5724619a",
          "slot": null,
          "required": false
        },
        {
          "path": "Cores/alfatreze.TAU/core.json",
          "role": "owned",
          "sha256": "e38c50310ad5c7ee688a3dee541d6f60b4d802d9f611449267ee621175a21826",
          "slot": null,
          "required": false
        },
        {
          "path": "Cores/alfatreze.TAU/data.json",
          "role": "owned",
          "sha256": "dab0149f8a5fcd968417d6017427993186f21a9b61598bc0ea2398fab4aa896d",
          "slot": null,
          "required": false
        },
        {
          "path": "Cores/alfatreze.TAU/icon.bin",
          "role": "owned",
          "sha256": "2221cf05ab14b9cca0c48b93a2e6176903a6a17e9ccdeacc03d2f3992540ce91",
          "slot": null,
          "required": false
        },
        {
          "path": "Cores/alfatreze.TAU/info.txt",
          "role": "owned",
          "sha256": "688815e8993928139ef10507024c7af765fb8e1d80610bf271d0732f7ccc8f75",
          "slot": null,
          "required": false
        },
        {
          "path": "Cores/alfatreze.TAU/input.json",
          "role": "owned",
          "sha256": "1f026a73eacbe9565f855af60387dbc9e3f179061bf274e797f22578a405675c",
          "slot": null,
          "required": false
        },
        {
          "path": "Cores/alfatreze.TAU/interact.json",
          "role": "owned",
          "sha256": "0ad46b7db6da8b23fd1f2ba7c6ceb1c674f75225e806c315662800ea4d152949",
          "slot": null,
          "required": false
        },
        {
          "path": "Cores/alfatreze.TAU/variants.json",
          "role": "owned",
          "sha256": "93bedfd28d1160474d79025a1bcaa10cdee8396699851d3ea3d747746a41e3ed",
          "slot": null,
          "required": false
        },
        {
          "path": "Cores/alfatreze.TAU/video.json",
          "role": "owned",
          "sha256": "45c1074326f53fe1ffa6fa121f4c9cac8ab248ce7acf448a779e6e379d7ae351",
          "slot": null,
          "required": false
        },
        {
          "path": "Platforms/_images/tau.bin",
          "role": "shared",
          "sha256": "f686014bb95aa2b57a26035bd2ed74529cedd3eb0a4f77e1ddda582d010e2fe7",
          "slot": null,
          "required": false
        },
        {
          "path": "Platforms/tau.json",
          "role": "shared",
          "sha256": "7220f696ede0d71229b18aebc09b100dd4bfd8383f5e0e7b752bf732fdd68cb1",
          "slot": null,
          "required": false
        },
        {
          "path": "Settings/alfatreze.TAU/Interact/interact_persist.json",
          "role": "user",
          "slot": null,
          "required": false,
          "format": {
            "name": "interact_persist",
            "version": 1
          }
        }
      ]
    }
  ],
  "requires_omega": {
    "library_index_version": 1,
    "assets_sections": [
      "METR",
      "PRST",
      "THEM"
    ],
    "assets_read_limit_bytes": 65536,
    "report_tags_max": 28,
    "persist_layout": 1,
    "packs_abi": 1,
    "persist_ids_changed": [
      10,
      11,
      12,
      15,
      16,
      20,
      21,
      22,
      23,
      24,
      25,
      26,
      27,
      28,
      29,
      30,
      31,
      32,
      33
    ],
    "min_omega": "0.6.0"
  },
  "notes": "",
  "source": {
    "commit": "1f667418",
    "dirty": false
  },
  "previous_release": "v0.6.1",
  "persist_registry": {
    "10": {
      "name": "(internal) playback",
      "meaning": 3,
      "since": "v0.7.0"
    },
    "11": {
      "name": "(internal) appearance",
      "meaning": 2,
      "since": "v0.7.0"
    },
    "12": {
      "name": "(internal) audio",
      "meaning": 2,
      "since": "v0.7.0"
    },
    "15": {
      "name": "(internal) meters 1",
      "meaning": 3,
      "since": "v0.7.0"
    },
    "16": {
      "name": "(internal) meters 2",
      "meaning": 3,
      "since": "v0.7.0"
    },
    "20": {
      "name": "(internal) tuning A 1",
      "meaning": 4,
      "since": "v0.7.0"
    },
    "21": {
      "name": "(internal) tuning A 2",
      "meaning": 4,
      "since": "v0.7.0"
    },
    "22": {
      "name": "(internal) tuning A 3",
      "meaning": 4,
      "since": "v0.7.0"
    },
    "23": {
      "name": "(internal) tuning A 4",
      "meaning": 4,
      "since": "v0.7.0"
    },
    "27": {
      "name": "(internal) tuning B 1",
      "meaning": 3,
      "since": "v0.7.0"
    },
    "28": {
      "name": "(internal) tuning B 2",
      "meaning": 3,
      "since": "v0.7.0"
    },
    "29": {
      "name": "(internal) tuning B 3",
      "meaning": 2,
      "since": "v0.7.0"
    },
    "30": {
      "name": "(internal) meters 3",
      "meaning": 2,
      "since": "v0.7.0"
    },
    "31": {
      "name": "(internal) last played 1",
      "meaning": 1,
      "since": "v0.7.0"
    },
    "32": {
      "name": "(internal) last played 2",
      "meaning": 1,
      "since": "v0.7.0"
    },
    "33": {
      "name": "(internal) tuning B 4",
      "meaning": 1,
      "since": "v0.7.0"
    }
  }
}
